{
  "schema_version": 1,
  "suite_id": "r07/read-only-live-v1",
  "status": "passed",
  "started_at": "2026-09-18T10:50:56Z",
  "finished_at": "2026-09-18T10:52:49Z",
  "controller_sha256": "7572b684af7e36197a75febfcd904048584e4fe9bb6abd52c7c983fdc9656df3",
  "fixture_sha256": "c8f5d0341d54d951a71b136e6e2afcb14d11ed8489a7ae126a8fee0df6ecf193",
  "rust": {
    "revision": "7231ddbbd838e87f2626c5a25b62b9ab89861f19",
    "tree": "430945dadab15122b2ae2f7ccd0f6471c7185f20",
    "source_sha256": "87446a3d2d5aa27f44491f3efabc1a9d25b0fc2be2b24570f50446a59a873d0d",
    "compiler_image": "rust:1.98.0-bookworm@sha256:82150a52ec202c1b14d7817e14516c392bb7f5cfebd88f1ed531cb37ebd39922",
    "platform": "linux/arm64",
    "binary_sha256": "ea94de691717d47a3068ad4320d1677b2d5722a3415b1ca7d54475e6de1d5181",
    "features": [],
    "build_command": "cargo build --locked --release -p rados-r07-tools --bin rados-r07-live",
    "build_exit_code": 0,
    "probe_exit_code": 0,
    "stdout_sha256": "3f33bfa067444dc63bd848ba88d4ae9400783be8c2ba379018e5ac3b58eb4910"
  },
  "go": {
    "revision": "c8bb148a1379b51ef87256c27f366a05f8da4dc4",
    "tree": "c5039b6b50a05b942a902f70dc2fcb090463e8c7",
    "compiler": "go1.26.8",
    "platform": "linux/arm64",
    "binary_sha256": "9b477ce4c20435bee83db59e3e71572520d5a5097aa8c3f866615061a230d1a1",
    "adapter_sha256": "d0d47d83e66979ff62564d1ce20731c3456523c9fe6d7f8506b592b1fb36a585",
    "build_command": "go build -trimpath ./integration/r07/probe",
    "build_exit_code": 0,
    "probe_exit_code": 0,
    "stdout_sha256": "3f33bfa067444dc63bd848ba88d4ae9400783be8c2ba379018e5ac3b58eb4910"
  },
  "server": {
    "source_anchor_commit": "7f793731f1b39eb4f465e960113d2363c311b964",
    "version": "ceph version 20.2.4 (7f793731f1b39eb4f465e960113d2363c311b964) tentacle (stable)",
    "image": "quay.io/ceph/ceph@sha256:6e6bc7b28fa1b334108a3646af5533dfb50db508efdf5b358eb7dd0dd37a48aa",
    "binary_sha256": "5fbad656b7f1bd900a0c40990a81be8dff523555ed0b2c957e38f29beb33608a"
  },
  "cluster": {
    "fsid": "11111111-2222-4333-8444-666666666666",
    "osds": 3,
    "pool": "p06-data",
    "replicas": 2
  },
  "scenarios": {
    "native_contents": "passed",
    "go_differential": "passed",
    "ranged_read": "passed",
    "full_read": "passed",
    "empty_read": "passed",
    "namespace_read": "passed",
    "locator_read": "passed",
    "stat_metadata": "passed",
    "missing_object": "passed",
    "operation_version": "passed",
    "primary_change": "passed"
  },
  "probe": {
    "ranged_read": true,
    "full_read": true,
    "empty_read": true,
    "namespace_read": true,
    "locator_read": true,
    "stat": true,
    "missing": true,
    "primary_change": true,
    "stat_size": 4096,
    "stat_mtime_seconds": 1789728761,
    "stat_mtime_nanosecond": 620672706,
    "version": 1
  },
  "go_probe": {
    "ranged_read": true,
    "full_read": true,
    "empty_read": true,
    "namespace_read": true,
    "locator_read": true,
    "stat": true,
    "missing": true,
    "primary_change": true,
    "stat_size": 4096,
    "stat_mtime_seconds": 1789728761,
    "stat_mtime_nanosecond": 620672706,
    "version": 1
  }
}
